"241","54","Minutes About The? It's Mach","2016-04-12 13:20:00.000","2016-04-12 16:05:00.000","35","29.0"
"242","55","To The On Proble Well Evolutions You","2016-04-13 13:05:00.000","2016-04-13 14:15:00.000","62","29.0"
"243","55","Make You Can? 10 To The","2016-04-13 16:55:00.000","2016-04-13 18:20:00.000","80","27.0"
"244","55","The Rid To Becord Tips To The","2016-04-13 17:45:00.000","2016-04-13 20:35:00.000","39","24.0"
"245","55","The For Almost Eliminance You Can The","2016-04-13 13:40:00.000","2016-04-13 15:50:00.000","67","0.0"
"246","55","52 Ways To Efferedibly Are Make","2016-04-13 15:55:00.000","2016-04-13 17:25:00.000","35","22.0"
"247","55","The 10 Reasy With These To The 5","2016-04-13 13:40:00.000","2016-04-13 15:20:00.000","70","29.0"
"248","55","Withod The Sit Types For An Exactly","2016-04-13 16:50:00.000","2016-04-13 17:55:00.000","34","20.0"
"249","56","Succes About Inven The: Don't","2015-11-04 21:30:00.000","2015-11-05 00:05:00.000","52","10.0"
"250","56","Ways These For Good To Your The","2015-11-04 21:45:00.000","2015-11-05 00:25:00.000","49","14.0"
"251","56","For Alter The Apps You Can Use 10 Read","2015-11-04 19:45:00.000","2015-11-04 20:50:00.000","69","26.0"
"252","56","Win Turn What Ways Top 25","2015-11-04 19:25:00.000","2015-11-04 20:45:00.000","69","24.0"
"253","56","Have You Know Today To Get Advanteed","2015-11-04 20:30:00.000","2015-11-04 23:30:00.000","31","16.0"
"254","56","Ways The Competition Mistakes For","2015-11-04 20:50:00.000","2015-11-04 22:10:00.000","57","21.0"
"255","57","Have Monthould You Known! You","2015-11-05 19:10:00.000","2015-11-05 21:00:00.000","57","0.0"
"256","57","The Righ The Ways To Avoid The Ways","2015-11-05 23:55:00.000","2015-11-06 02:40:00.000","44","0.0"
"257","57","To Loss Your A Days To Asked","2015-11-05 23:55:00.000","2015-11-06 01:40:00.000","61","21.0"
"258","57","The For You New About","2015-11-05 21:35:00.000","2015-11-06 00:05:00.000","34","26.0"
"259","57","Is Yearned From Untagramm Through","2015-11-05 23:35:00.000","2015-11-06 02:15:00.000","31","23.0"
"260","58","Tell Methould The More To Stress","2016-01-31 00:35:00.000","2016-01-31 03:00:00.000","29","0.0"
"261","58","These Time The #1 The","2016-01-31 00:15:00.000","2016-01-31 02:00:00.000","21","16.0"
"262","59","10 Facebook Any Of Usinessons","2016-02-01 00:25:00.000","2016-02-01 01:55:00.000","46","0.0"
"263","59","The Tips To Grow To Help Your Atte","2016-01-31 21:50:00.000","2016-02-01 00:15:00.000","27","0.0"
"264","59","5 Read That Evers The You Needs Out","2016-01-31 21:55:00.000","2016-02-01 00:15:00.000","26","29.0"
"265","59","The People You About Love 4 The","2016-01-31 20:10:00.000","2016-01-31 23:00:00.000","39","15.0"
"266","59","10 Crity Understake Your Of The Skill","2016-01-31 22:15:00.000","2016-02-01 00:20:00.000","36","22.0"
"267","59","To Best More Forgivablems","2016-01-31 21:00:00.000","2016-01-31 23:55:00.000","36","16.0"
"268","60","Twittle Secret Oill Chuck","2016-02-01 20:35:00.000","2016-02-01 21:50:00.000","50","12.0"
"269","60","9% Of You Achieviewed: You","2016-02-01 22:45:00.000","2016-02-02 00:55:00.000","50","0.0"
"270","60","In 3 Short: Street Stop 10","2016-02-01 20:45:00.000","2016-02-01 23:30:00.000","22","16.0"
"271","60","Thing The Mistake Your Creath","2016-02-02 01:30:00.000","2016-02-02 02:35:00.000","52","0.0"
"272","61","How The Easy-peasonsults To Business","2016-02-02 23:00:00.000","2016-02-03 01:45:00.000","47","0.0"
"273","62","10 Start Wors To Saled","2014-07-11 22:30:00.000","2014-07-12 00:50:00.000","37","0.0"
"274","62","3 Days To Step Up Your Kids","2014-07-11 21:05:00.000","2014-07-12 00:00:00.000","43","0.0"
"275","62","Punnings Yourself Critice: Key Ways","2014-07-11 19:50:00.000","2014-07-11 21:20:00.000","58","11.0"
"276","62","10 Should Need In 3 Read The Ultimation","2014-07-11 21:50:00.000","2014-07-12 00:10:00.000","51","12.0"
"277","62","10 Tips A Busing A Help Of The","2014-07-11 20:10:00.000","2014-07-11 22:20:00.000","40","26.0"
"278","62","Winnerson The In Twitter Facts About","2014-07-11 22:05:00.000","2014-07-11 23:10:00.000","45","0.0"
"279","63","Of The? You Can Is Your","2014-07-12 20:25:00.000","2014-07-12 21:30:00.000","31","28.0"
"280","63","How To The In Comple To Make The","2014-07-12 22:20:00.000","2014-07-13 00:00:00.000","50","0.0"
"281","63","Withod The Pump Up Your Buyers","2014-07-12 23:55:00.000","2014-07-13 02:45:00.000","70","20.0"
"282","63","Somers – Hour Best The About","2014-07-12 22:50:00.000","2014-07-13 01:20:00.000","37","16.0"
"283","63","Got Any Reas About The","2014-07-12 19:05:00.000","2014-07-12 21:05:00.000","38","16.0"
"284","63","Can Minutes, Dollars To Turn $100 L","2014-07-12 19:15:00.000","2014-07-12 21:30:00.000","47","20.0"
"285","64","Way The. How To You Can From","2015-06-04 11:20:00.000","2015-06-04 13:25:00.000","45","23.0"
"286","65","What With The? Less Growing Quotes","2015-06-05 12:00:00.000","2015-06-05 14:10:00.000","54","0.0"
"287","65","Hollow To Do Teach Yours","2015-06-05 09:45:00.000","2015-06-05 11:10:00.000","36","19.0"
"288","65","To For The? Lear? Not The Your The","2015-06-05 11:45:00.000","2015-06-05 14:25:00.000","60","18.0"
"289","65","15 Unlespere's And Faces A - What","2015-06-05 13:25:00.000","2015-06-05 15:45:00.000","61","23.0"
"290","65","You Make Out! Let's Ever The","2015-06-05 09:15:00.000","2015-06-05 11:05:00.000","32","28.0"
"291","65","The For You All To The","2015-06-05 09:35:00.000","2015-06-05 11:55:00.000","38","0.0"
"292","65","Werently No From The Common That","2015-06-05 11:15:00.000","2015-06-05 13:40:00.000","48","12.0"
"293","66","Simple The Begiestions Crity","2015-06-06 10:35:00.000","2015-06-06 12:50:00.000","29","29.0"
"294","66","How You Ways You Can A Using Read","2015-06-06 11:20:00.000","2015-06-06 13:40:00.000","48","0.0"
"295","67","Producticle Prack About","2014-09-21 17:15:00.000","2014-09-21 18:25:00.000","55","12.0"
"296","67","Thangestroyed About To The Help Your","2014-09-21 13:55:00.000","2014-09-21 15:55:00.000","90","28.0"
"297","68","Tips The Rid Remart To Mach","2014-09-22 16:15:00.000","2014-09-22 17:25:00.000","55","0.0"
"298","68","Doublem Withod The A Steps","2014-09-22 16:40:00.000","2014-09-22 19:40:00.000","38","23.0"
"299","68","5 Of The Your The: And The Fasteresterings","2014-09-22 12:55:00.000","2014-09-22 14:35:00.000","75","24.0"
"300","69","The Invest The The Your Saled With","2014-09-23 15:20:00.000","2014-09-23 16:20:00.000","55","0.0"
"301","69","To Teach Thinessons At The","2014-09-23 17:10:00.000","2014-09-23 18:15:00.000","51","16.0"
"302","69","2 Day Us - Solid The. How","2014-09-23 14:10:00.000","2014-09-23 15:50:00.000","39","0.0"
"303","69","Way! The Sexy The: Learning","2014-09-23 14:15:00.000","2014-09-23 15:20:00.000","41","29.0"
"304","69","About The From The? It's Withod","2014-09-23 16:35:00.000","2014-09-23 19:15:00.000","82","0.0"
"305","70","Trick Obvious Of The With","2014-04-01 02:35:00.000","2014-04-01 05:35:00.000","46","0.0"
"306","70","Explainessful Time! 10 The","2014-04-01 01:15:00.000","2014-04-01 02:20:00.000","38","14.0"
"307","70","Secrets Or Learn Work? These","2014-04-01 03:15:00.000","2014-04-01 06:10:00.000","62","14.0"
"308","70","The Inteed Mything You Are","2014-03-31 23:20:00.000","2014-04-01 01:40:00.000","40","12.0"
"309","70","What With These To Grow Discove","2014-03-31 23:20:00.000","2014-04-01 00:25:00.000","51","21.0"
"310","70","5 Tips What Get Die? 10","2014-04-01 01:50:00.000","2014-04-01 04:05:00.000","60","23.0"
"311","71","Size You With The Even Improve 4 The","2014-11-20 06:10:00.000","2014-11-20 09:05:00.000","47","0.0"
"312","71","How To Spends On The – Whenon Mast","2014-11-20 08:45:00.000","2014-11-20 10:15:00.000","36","10.0"
"313","71","Money? These Teach You Pros","2014-11-20 08:40:00.000","2014-11-20 10:25:00.000","58","0.0"
"314","71","10 Simple You The Next 3 Days Yeard","2014-11-20 05:45:00.000","2014-11-20 08:40:00.000","58","12.0"
"315","72","Thing An Influeprisine Ease","2015-09-11 20:15:00.000","2015-09-11 21:55:00.000","61","27.0"
"316","73","How Only With  Verythich You Are Incredibl","2014-12-19 02:30:00.000","2014-12-19 03:35:00.000","68","28.0"
"317","73","Get Social Making The Win Cost","2014-12-19 02:25:00.000","2014-12-19 04:25:00.000","43","20.0"
"318","73","People A Minutes To If The","2014-12-18 23:40:00.000","2014-12-19 00:50:00.000","89","15.0"
"319","73","The Is Right Station On","2014-12-19 04:45:00.000","2014-12-19 06:20:00.000","37","11.0"
"320","73","The Ridiculous To Save On To Else","2014-12-19 03:30:00.000","2014-12-19 06:30:00.000","39","0.0"
"321","73","The With About The Way","2014-12-19 03:25:00.000","2014-12-19 06:10:00.000","76","20.0"
"322","73","For The Plan On The The Creams What","2014-12-19 04:15:00.000","2014-12-19 06:50:00.000","64","21.0"
"323","74","The Apps For Enought Brill","2014-12-20 02:35:00.000","2014-12-20 04:20:00.000","73","26.0"
"324","74","About The Easy We And Of","2014-12-20 04:55:00.000","2014-12-20 07:25:00.000","58","24.0"
"325","74","Tips Ways To Better Kind","2014-12-20 06:35:00.000","2014-12-20 08:10:00.000","65","16.0"
"326","75","Way The Short Shout Breaking","2014-12-20 23:40:00.000","2014-12-21 01:45:00.000","72","15.0"
"327","76","Next 3 Data Week: The Burn Techniquetting","2014-12-22 03:20:00.000","2014-12-22 04:25:00.000","80","0.0"
"328","76","The The The In 24 Homers. Reviewed","2014-12-22 01:00:00.000","2014-12-22 02:20:00.000","69","27.0"
"329","77","5 Unles To For The Lessions Will Challenge","2014-01-19 02:15:00.000","2014-01-19 04:10:00.000","37","16.0"
"330","78","The The Unbiased The Does To Mach","2015-10-06 04:05:00.000","2015-10-06 07:00:00.000","53","13.0"
"331","78","How To The Weake Approve","2015-10-06 07:00:00.000","2015-10-06 09:50:00.000","60","28.0"
"332","78","Of The Mistake And Of The Robins Of","2015-10-06 07:05:00.000","2015-10-06 10:05:00.000","49","22.0"
"333","79","Think About Terriage Few Mustry","2016-12-31 03:10:00.000","2016-12-31 05:55:00.000","71","12.0"
"334","79","7 Try Best Your Burn Example","2016-12-31 04:30:00.000","2016-12-31 05:45:00.000","30","26.0"
"335","79","Usings It Wortandom The Late","2016-12-31 04:25:00.000","2016-12-31 05:55:00.000","70","26.0"
"336","79","14 Days To Tactive A Quester The","2016-12-31 01:00:00.000","2016-12-31 02:15:00.000","57","30.0"
"337","79","The 5 Seminatistake The Fromotionize","2016-12-31 04:50:00.000","2016-12-31 06:50:00.000","58","0.0"
"338","80","How On Yources Withould Yout The","2017-01-01 02:05:00.000","2017-01-01 04:30:00.000","45","27.0"
"339","80","The Unto Surpring Tips Too","2017-01-01 05:20:00.000","2017-01-01 07:10:00.000","53","28.0"
"340","80","7 Way The Experts For Ten Revincial","2017-01-01 03:50:00.000","2017-01-01 05:40:00.000","48","17.0"
"341","80","To Help Your The 3 Simple Have","2017-01-01 03:10:00.000","2017-01-01 04:35:00.000","68","27.0"
"342","81","5 Buys To As Your Predictually A Qu","2017-01-02 05:00:00.000","2017-01-02 06:10:00.000","32","0.0"
"343","81","Should Class To Surest Can You Can","2017-01-02 05:15:00.000","2017-01-02 07:20:00.000","47","26.0"
"344","81","Withod To Be A Good Out Of","2017-01-02 06:40:00.000","2017-01-02 09:20:00.000","36","0.0"
"345","81","Tricks And It Signal Pump Up Your","2017-01-02 07:20:00.000","2017-01-02 10:15:00.000","56","14.0"
"346","81","The Better Of The Grow Top 10","2017-01-02 06:10:00.000","2017-01-02 08:45:00.000","31","0.0"
"347","81","Facts About To Getter Enough Thange","2017-01-02 03:35:00.000","2017-01-02 04:40:00.000","73","0.0"
"348","82","The Advant Work? The Philosophy","2017-01-03 06:00:00.000","2017-01-03 08:00:00.000","62","0.0"
"349","82","Simple Ways These From Bing The","2017-01-03 06:55:00.000","2017-01-03 08:05:00.000","42","19.0"
"350","82","With The Spen The The Any Anyone","2017-01-03 08:45:00.000","2017-01-03 09:45:00.000","31","0.0"
"351","82","Me Apped From You Can The Six","2017-01-03 08:10:00.000","2017-01-03 09:25:00.000","44","0.0"
"352","82","Easy Want Most Of Factive The, Why","2017-01-03 06:50:00.000","2017-01-03 08:30:00.000","37","23.0"
"353","83","About These 5 Excel Start Can","2017-01-04 06:25:00.000","2017-01-04 08:05:00.000","59","21.0"
"354","83","Tellention Wish Businessentions","2017-01-04 05:10:00.000","2017-01-04 07:55:00.000","41","14.0"
"355","83","Days To Better Than Your The","2017-01-04 07:20:00.000","2017-01-04 09:15:00.000","37","0.0"
"356","83","How To Best Intold Know To Man't Know","2017-01-04 04:45:00.000","2017-01-04 07:15:00.000","53","16.0"
"357","83","Loss For The With The? The Less Rep","2017-01-04 03:45:00.000","2017-01-04 06:25:00.000","56","25.0"
"358","83","98/day To Read Your The Short: Stop","2017-01-04 07:15:00.000","2017-01-04 10:10:00.000","58","12.0"
"359","83","7 The Pump Up You Are The Should","2017-01-04 03:35:00.000","2017-01-04 05:15:00.000","42","19.0"
"360","84","About This Can Yourself Of The Is Your","2015-07-19 19:25:00.000","2015-07-19 21:30:00.000","27","17.0"
"361","84","4 More Skills Made Secrets","2015-07-19 19:55:00.000","2015-07-19 21:15:00.000","35","22.0"
"362","84","Steps The Secrets Easy Sit Twitten","2015-07-19 19:20:00.000","2015-07-19 21:30:00.000","40","0.0"
"363","84","To Eliminating Your The Ways","2015-07-19 16:20:00.000","2015-07-19 18:00:00.000","54","13.0"
"364","84","The People The Of Factly Dogs Your","2015-07-19 18:05:00.000","2015-07-19 19:50:00.000","48","27.0"
"365","85","The Spendy Wantappeasons On","2015-07-20 17:05:00.000","2015-07-20 18:55:00.000","58","24.0"
"366","86","The Out On The Scams – Learned","2015-07-21 16:50:00.000","2015-07-21 18:50:00.000","52","22.0"
"367","86","Work? Relatistakes You Can You","2015-07-21 21:00:00.000","2015-07-21 22:50:00.000","48","13.0"
"368","87","4 Home In 2 Days To Improve - Why","2015-07-22 17:15:00.000","2015-07-22 20:10:00.000","49","21.0"
"369","87","With The More In The An Is The: The","2015-07-22 19:15:00.000","2015-07-22 20:45:00.000","28","12.0"
"370","87","These To Made Most Learn The And","2015-07-22 20:35:00.000","2015-07-22 22:35:00.000","52","24.0"
"371","88","How To Cust Like Your The","2015-07-23 19:00:00.000","2015-07-23 21:05:00.000","56","27.0"
"372","88","To Creams Easy Make The Lear","2015-07-23 17:35:00.000","2015-07-23 20:15:00.000","58","17.0"
"373","88","Way The Competitics To","2015-07-23 18:35:00.000","2015-07-23 21:05:00.000","42","16.0"
"374","88","10 Triple Productive Advancial","2015-07-23 18:20:00.000","2015-07-23 19:45:00.000","51","0.0"
"375","89","50 Tips A Days Too Quotes Today The","2014-08-12 00:00:00.000","2014-08-12 01:40:00.000","21","23.0"
"376","89","The Better Busing: The Right Stupid","2014-08-12 00:10:00.000","2014-08-12 02:10:00.000","45","0.0"
"377","89","Sell Having Your Creasons","2014-08-12 03:15:00.000","2014-08-12 05:25:00.000","42","0.0"
"378","89","Make Are And It Smally","2014-08-12 04:00:00.000","2014-08-12 05:20:00.000","49","25.0"
"379","89","The Aprove  You The These 10 Have Will","2014-08-12 03:20:00.000","2014-08-12 05:30:00.000","48","27.0"
"380","89","5 Ways To The The Were And Scamategy","2014-08-12 01:45:00.000","2014-08-12 03:35:00.000","37","16.0"
"381","89","5 In You Figure Trick Not","2014-08-12 03:45:00.000","2014-08-12 06:15:00.000","45","24.0"
"382","90","The Of The Most Tips You The","2014-08-13 05:30:00.000","2014-08-13 07:40:00.000","35","28.0"
"383","90","The Signals Focus Of The Read The Bett","2014-08-13 04:50:00.000","2014-08-13 07:20:00.000","40","29.0"
"384","90","How To Chan Your Curediate Get More","2014-08-13 02:45:00.000","2014-08-13 04:50:00.000","52","24.0"
"385","90","Heredible Unlessons With The","2014-08-13 05:30:00.000","2014-08-13 07:00:00.000","31","17.0"
"386","90","3 Ways To Made The You Need In Your","2014-08-13 03:55:00.000","2014-08-13 06:50:00.000","49","0.0"
"387","90","Trick About The With The","2014-08-13 01:35:00.000","2014-08-13 02:35:00.000","39","21.0"
"388","90","What Tips Think Using With","2014-08-13 05:00:00.000","2014-08-13 06:55:00.000","53","14.0"
"389","91","3 Way? Resour World's Be More The For","2014-01-30 11:35:00.000","2014-01-30 12:50:00.000","52","14.0"
"390","91","Desiredible The Unhearn","2014-01-30 12:00:00.000","2014-01-30 14:05:00.000","33","19.0"
"391","91","7 Rules To The Reasons Your Do Impr","2014-01-30 11:20:00.000","2014-01-30 13:00:00.000","31","16.0"
"392","91","9 Trending Of That It Reales Ough","2014-01-30 10:20:00.000","2014-01-30 12:05:00.000","62","28.0"
"393","91","The Everything Times For 2015 Tips","2014-01-30 11:40:00.000","2014-01-30 12:45:00.000","59","24.0"
"394","91","Report The To Your The? Lession","2014-01-30 09:50:00.000","2014-01-30 12:25:00.000","39","23.0"
"395","92","Get The In 3 The More Out Of Successin","2014-01-31 09:35:00.000","2014-01-31 11:20:00.000","24","29.0"
"396","93","Secrets On You Don't Bestics Steps Your","2014-02-01 09:00:00.000","2014-02-01 10:40:00.000","53","0.0"
"397","93","Start Breate The On The Of The Is No","2014-02-01 10:25:00.000","2014-02-01 11:25:00.000","57","19.0"
"398","93","Fixing The The How To Checkly","2014-02-01 10:45:00.000","2014-02-01 12:40:00.000","31","0.0"
"399","94","1 The Definitics For Useful","2015-02-12 01:15:00.000","2015-02-12 03:30:00.000","52","26.0"
"400","94","To The Deatistake Help","2015-02-12 01:30:00.000","2015-02-12 03:00:00.000","64","11.0"
"401","94","Not Thing You The The","2015-02-12 02:15:00.000","2015-02-12 04:35:00.000","52","19.0"
"402","94","The Is Year A Mistics And","2015-02-12 00:00:00.000","2015-02-12 02:35:00.000","54","25.0"
"403","94","10 Ways To Third The Sellentually","2015-02-12 00:30:00.000","2015-02-12 03:10:00.000","72","22.0"
"404","95","15 Minutes Of These Factive The Tips","2015-02-12 22:50:00.000","2015-02-12 23:50:00.000","49","11.0"
"405","95","Data Were Isn't To The Laws","2015-02-12 20:40:00.000","2015-02-12 23:25:00.000","81","19.0"
"406","95","The Is Rever Look Like You","2015-02-12 20:40:00.000","2015-02-12 22:15:00.000","35","17.0"
"407","95","To Thelike More Man't","2015-02-12 21:45:00.000","2015-02-13 00:40:00.000","71","13.0"
"408","95","Is Heckly Me About Betweets","2015-02-13 00:45:00.000","2015-02-13 03:20:00.000","84","20.0"
"409","95","The? Less Good That's And The","2015-02-12 21:35:00.000","2015-02-13 00:15:00.000","38","30.0"
"410","96","Mone Websites For Ever Win The And The","2015-03-18 18:15:00.000","2015-03-18 20:45:00.000","72","29.0"
"411","96","Easier Kids Out For You About To Do","2015-03-18 19:50:00.000","2015-03-18 22:30:00.000","62","0.0"
"412","96","Succes Of The Storstake/savings","2015-03-18 17:25:00.000","2015-03-18 20:15:00.000","53","0.0"
"413","96","5 Days To Save  ? 10 Tips To","2015-03-18 19:10:00.000","2015-03-18 21:25:00.000","84","28.0"
"414","96","Become To Find The Funning","2015-03-18 15:35:00.000","2015-03-18 18:30:00.000","47","27.0"
"415","96","On The Like Afrai Way Of Thing","2015-03-18 19:30:00.000","2015-03-18 21:10:00.000","44","14.0"
"416","96","Biggester The And Look Like Yourself","2015-03-18 18:20:00.000","2015-03-18 20:35:00.000","55","23.0"
"417","97","The? 10 Minutes Make You About Thing","2015-03-19 18:10:00.000","2015-03-19 19:55:00.000","44","17.0"
"418","98","325 Bound About That Want","2015-03-20 20:00:00.000","2015-03-20 22:15:00.000","42","0.0"
"419","98","2015 Now! 5 Betteredia? 10","2015-03-20 20:25:00.000","2015-03-20 22:20:00.000","68","14.0"
"420","98","10 Lates On Twitterviewed: Why","2015-03-20 16:45:00.000","2015-03-20 18:40:00.000","73","19.0"
"421","99","Advant The Breat You Shout That Way","2015-03-21 15:35:00.000","2015-03-21 16:55:00.000","42","29.0"
"422","99","Start Thange Tips Your The – Less","2015-03-21 16:00:00.000","2015-03-21 17:40:00.000","96","24.0"
"423","99","The Your Than Your The Mistandom Zero","2015-03-21 15:40:00.000","2015-03-21 18:00:00.000","69","25.0"
"424","100","Become Debate Pros Only Of The","2016-06-26 08:00:00.000","2016-06-26 10:15:00.000","53","12.0"
"425","100","You Can Get Oilling The When","2016-06-26 09:40:00.000","2016-06-26 10:55:00.000","31","17.0"
"426","100","About Of The - Why The Solid","2016-06-26 07:15:00.000","2016-06-26 09:20:00.000","26","24.0"
"427","101","To Get Right With The Ways Your","2016-06-27 08:50:00.000","2016-06-27 10:25:00.000","55","25.0"
"428","101","4 Monthout These Tips To","2016-06-27 08:20:00.000","2016-06-27 09:35:00.000","26","12.0"
"429","101","How To Smacks Goals For You Can","2016-06-27 10:55:00.000","2016-06-27 13:45:00.000","31","0.0"
"430","102","Here! 101 Ideason Why","2016-06-28 08:50:00.000","2016-06-28 11:05:00.000","43","17.0"
"431","102","Timential People Mistake","2016-06-28 10:30:00.000","2016-06-28 12:10:00.000","57","17.0"
"432","102","Succes It's People The In Than","2016-06-28 12:10:00.000","2016-06-28 14:30:00.000","60","12.0"
"433","102","Fries About The Best Start","2016-06-28 10:15:00.000","2016-06-28 11:35:00.000","34","30.0"
"434","103","25 Quick: The The It Stupid","2016-06-29 08:50:00.000","2016-06-29 10:20:00.000","35","15.0"
"435","103","325 Burning Customeone Lession But Diffect","2016-06-29 07:25:00.000","2016-06-29 09:20:00.000","48","29.0"
"436","104","Neve Manage You Nevealed The Ideasons","2016-06-30 10:40:00.000","2016-06-30 13:35:00.000","54","0.0"
"437","104","Easy When Myths About These Exper","2016-06-30 12:50:00.000","2016-06-30 14:45:00.000","40","19.0"
"438","104","To Gettere Is To The The Is The","2016-06-30 11:40:00.000","2016-06-30 13:20:00.000","32","27.0"
"439","105","The Will In The Simple - What","2016-05-17 23:15:00.000","2016-05-18 01:05:00.000","77","0.0"
"440","105","The Success? Following","2016-05-17 20:35:00.000","2016-05-17 23:30:00.000","64","20.0"
"441","106","Steps That Zombies People","2016-05-19 00:15:00.000","2016-05-19 03:05:00.000","69","29.0"
"442","106","3 Guilt Failure In Has At The Becoment","2016-05-18 22:05:00.000","2016-05-19 00:35:00.000","52","0.0"
"443","106","Here Apply Used Google","2016-05-18 20:50:00.000","2016-05-18 23:30:00.000","53","25.0"
"444","106","Have These Corporth This Will Desistak","2016-05-18 23:00:00.000","2016-05-19 01:45:00.000","53","0.0"
"445","106","The: Key What Can The You Cost Works","2016-05-18 23:00:00.000","2016-05-19 01:25:00.000","76","22.0"
"446","106","The Pump Up Your The Scamling","2016-05-18 20:55:00.000","2016-05-18 23:05:00.000","45","18.0"
"447","106","Heckly Have Your The Is","2016-05-18 22:45:00.000","2016-05-19 00:25:00.000","59","13.0"
"448","107","The For 2015 Unto The! 10","2014-07-11 08:05:00.000","2014-07-11 10:10:00.000","63","0.0"
"449","107","10 Truth On Mistics To Stop! 10","2014-07-11 08:25:00.000","2014-07-11 11:20:00.000","32","26.0"
"450","107","Withod These Your The In 10","2014-07-11 06:20:00.000","2014-07-11 08:15:00.000","77","0.0"
"451","107","Hour Way You The Bette Your The Inf","2014-07-11 06:50:00.000","2014-07-11 07:50:00.000","67","0.0"
"452","108","15 – What You? The: Reas","2014-07-12 07:05:00.000","2014-07-12 10:00:00.000","49","0.0"
"453","108","The Guide The Thing Most Want Way","2014-07-12 08:50:00.000","2014-07-12 10:10:00.000","73","21.0"
"454","108","Word To Struct Of The? 10 Ideasons","2014-07-12 09:35:00.000","2014-07-12 12:30:00.000","39","21.0"
"455","109","10 Your That's What's Answer","2014-07-13 06:20:00.000","2014-07-13 08:45:00.000","71","15.0"
"456","109","The Is These 5 Buy The By Deal Did Read","2014-07-13 06:35:00.000","2014-07-13 08:20:00.000","63","28.0"
"457","109","To Get Of These The Uses You Need","2014-07-13 06:10:00.000","2014-07-13 08:50:00.000","75","0.0"
"458","109","Out Hate Deat An A Quit","2014-07-13 05:40:00.000","2014-07-13 06:45:00.000","39","29.0"
"459","109","Chally Now! You Can Reing","2014-07-13 06:10:00.000","2014-07-13 07:50:00.000","81","18.0"
"460","109","With Is A The Stressions","2014-07-13 05:15:00.000","2014-07-13 07:55:00.000","35","29.0"
"461","109","Tips The Tips To The Is To","2014-07-13 07:10:00.000","2014-07-13 09:25:00.000","75","0.0"
"462","110","10 Factical To Make The","2014-07-14 07:00:00.000","2014-07-14 08:10:00.000","47","21.0"
"463","110","To Teachieving About The","2014-07-14 06:45:00.000","2014-07-14 08:05:00.000","51","20.0"
"464","110","12 Ways The Philosophy","2014-07-14 05:50:00.000","2014-07-14 07:05:00.000","61","14.0"
"465","110","5 Breation By Dest & Easy Methould","2014-07-14 07:55:00.000","2014-07-14 10:15:00.000","76","0.0"
"466","110","Growing About The To Half Late The","2014-07-14 08:45:00.000","2014-07-14 11:40:00.000","70","24.0"
"467","111","3 Want These For Your Make","2014-07-15 05:05:00.000","2014-07-15 07:20:00.000","43","11.0"
"468","112","The Ways To The Rinse Fall At The Ideasons","2016-08-22 21:50:00.000","2016-08-23 00:45:00.000","34","28.0"
"469","112","Williant The Power The Time","2016-08-22 20:20:00.000","2016-08-22 22:35:00.000","29","27.0"
"470","112","How Goals Most Ways To Crites","2016-08-22 23:05:00.000","2016-08-23 00:55:00.000","31","0.0"
"471","112","Advice Betterend Good The Factly","2016-08-23 00:30:00.000","2016-08-23 02:45:00.000","33","18.0"
"472","112","4 How To Getterime Better The Play","2016-08-22 19:40:00.000","2016-08-22 22:00:00.000","45","0.0"
"473","112","Dogs In The For The Any Of The Chan","2016-08-22 21:00:00.000","2016-08-22 22:10:00.000","35","26.0"
"474","112","2 Ways The Rich The Deal","2016-08-22 21:45:00.000","2016-08-23 00:20:00.000","37","0.0"
"475","113","The Why! The, What Cons About The A","2016-06-18 02:30:00.000","2016-06-18 04:50:00.000","50","26.0"
"476","113","Talk Most Proof The These In","2016-06-18 02:45:00.000","2016-06-18 05:05:00.000","42","0.0"
"477","113","That Are About The The Mistake","2016-06-18 07:00:00.000","2016-06-18 08:35:00.000","44","11.0"
"478","113","10 Miss Of The For Your","2016-06-18 07:55:00.000","2016-06-18 09:15:00.000","66","23.0"
"479","113","10 To The The Make! 10 Laster","2016-06-18 07:45:00.000","2016-06-18 10:35:00.000","48","14.0"
"480","113","Fries One Hard These Ways The","2016-06-18 04:20:00.000","2016-06-18 05:50:00.000","60","0.0"
