"720","171","Way The Guide Are Laws About The At","2015-11-21 13:40:00.000","2015-11-21 16:40:00.000","57","0.0"
"721","171","The? The Proble Products About","2015-11-21 15:25:00.000","2015-11-21 17:05:00.000","60","16.0"
"722","172","Google.come The Thing The A Prom The","2015-11-22 17:05:00.000","2015-11-22 19:40:00.000","45","0.0"
"723","172","The - So The 5 Data Weeke Tips Forge","2015-11-22 13:30:00.000","2015-11-22 14:30:00.000","70","12.0"
"724","172","The - Right The No Samedictionablem","2015-11-22 17:35:00.000","2015-11-22 18:40:00.000","89","0.0"
"725","172","These For At The Makes What","2015-11-22 17:20:00.000","2015-11-22 18:35:00.000","60","11.0"
"726","172","Find The: Report: Start This Easive","2015-11-22 14:35:00.000","2015-11-22 16:25:00.000","44","19.0"
"727","172","To Power Usiness Out To To","2015-11-22 18:05:00.000","2015-11-22 19:05:00.000","84","29.0"
"728","172","Ways You? Hearn Techniquetter","2015-11-22 15:45:00.000","2015-11-22 18:10:00.000","45","18.0"
"729","173","Failuredible These The On Thange","2014-12-13 13:25:00.000","2014-12-13 15:20:00.000","42","22.0"
"730","173","To Hecklish For Atten","2014-12-13 17:45:00.000","2014-12-13 19:20:00.000","23","23.0"
"731","173","Find Thing To Know To Made Make","2014-12-13 17:50:00.000","2014-12-13 20:45:00.000","43","10.0"
"732","173","52 Way To Mangings A Success","2014-12-13 15:45:00.000","2014-12-13 18:10:00.000","40","0.0"
"733","173","5 Easy Make The #1 The Becord","2014-12-13 16:10:00.000","2014-12-13 18:45:00.000","43","0.0"
"734","174","How The Quit With The 5 Stratulationals","2014-12-14 15:20:00.000","2014-12-14 18:05:00.000","31","0.0"
"735","174","5 Books Without Out The Ways The And","2014-12-14 14:00:00.000","2014-12-14 16:45:00.000","37","20.0"
"736","174","Creaking You Can One What","2014-12-14 15:25:00.000","2014-12-14 17:55:00.000","61","23.0"
"737","174","To Simplete School Tips To","2014-12-14 16:00:00.000","2014-12-14 17:50:00.000","30","28.0"
"738","174","Matter Buyers Abuse 10 Ques Of The","2014-12-14 14:00:00.000","2014-12-14 16:55:00.000","34","28.0"
"739","174","A Success Reveryoney The","2014-12-14 14:20:00.000","2014-12-14 15:40:00.000","28","0.0"
"740","174","Ways To Help Your The Excell You Diffec","2014-12-14 17:00:00.000","2014-12-14 18:40:00.000","29","21.0"
"741","175","2015 Less You Doming Of The How Abo","2014-12-15 17:45:00.000","2014-12-15 20:40:00.000","48","30.0"
"742","175","10 Tip The The Truth Thing And The","2014-12-15 18:45:00.000","2014-12-15 21:25:00.000","25","11.0"
"743","175","To For Behing Think Us Lately","2014-12-15 20:35:00.000","2014-12-15 22:10:00.000","49","11.0"
"744","175","The Ultimate To Start The Pros","2014-12-15 17:00:00.000","2014-12-15 19:05:00.000","26","29.0"
"745","175","Read The? Read The Improved To","2014-12-15 16:25:00.000","2014-12-15 18:45:00.000","32","0.0"
"746","175","The Influencessons Way The 2.0","2014-12-15 16:30:00.000","2014-12-15 18:05:00.000","29","0.0"
"747","176","How To Elems – How The More","2014-12-16 17:00:00.000","2014-12-16 18:10:00.000","39","11.0"
"748","176","Dest They These - Facts I","2014-12-16 19:45:00.000","2014-12-16 21:30:00.000","60","13.0"
"749","176","Tween The Of Thange Has From","2014-12-16 19:55:00.000","2014-12-16 21:15:00.000","28","12.0"
"750","176","Mistantagrabbins Why Hate","2014-12-16 17:10:00.000","2014-12-16 19:35:00.000","53","16.0"
"751","176","The The Is And From No","2014-12-16 16:10:00.000","2014-12-16 19:10:00.000","54","18.0"
"752","177","10 Were On The Neve Your But Thinding","2014-12-17 15:15:00.000","2014-12-17 16:45:00.000","58","24.0"
"753","177","7 In The! Step It Should","2014-12-17 15:30:00.000","2014-12-17 16:40:00.000","49","24.0"
"754","177","Work…formateginner, Choosiness To","2014-12-17 18:55:00.000","2014-12-17 20:35:00.000","52","14.0"
"755","177","44 Instake Made Focus 7 Most The","2014-12-17 14:50:00.000","2014-12-17 16:35:00.000","53","19.0"
"756","177","That Theme This Tween","2014-12-17 15:20:00.000","2014-12-17 18:10:00.000","39","0.0"
"757","178","Works Of The The Apps Of You","2014-02-14 13:25:00.000","2014-02-14 14:35:00.000","38","30.0"
"758","178","3 The Guideniable Ultimationable","2014-02-14 14:25:00.000","2014-02-14 16:20:00.000","61","0.0"
"759","178","10 Time! 5 The Ultimationize You And","2014-02-14 13:30:00.000","2014-02-14 16:10:00.000","38","29.0"
"760","178","Tips And A Prepare In 101 Ideas","2014-02-14 11:30:00.000","2014-02-14 14:10:00.000","55","17.0"
"761","178","10 That Your Custome The Tips You","2014-02-14 10:50:00.000","2014-02-14 13:45:00.000","57","26.0"
"762","179","Can Have Mone Exactly And From That","2014-02-15 11:10:00.000","2014-02-15 14:05:00.000","36","0.0"
"763","179","Right Want Alterencess To The? 101","2014-02-15 10:10:00.000","2014-02-15 12:00:00.000","41","0.0"
"764","179","11 Method Of The Don't Watch","2014-02-15 11:10:00.000","2014-02-15 14:05:00.000","63","12.0"
"765","179","7 The Defeates You Make, Thereationable","2014-02-15 08:55:00.000","2014-02-15 10:30:00.000","42","24.0"
"766","179","Half Lasted About The Make Throught","2014-02-15 07:45:00.000","2014-02-15 10:05:00.000","60","17.0"
"767","179","You Dogs Today The The Simplify","2014-02-15 08:35:00.000","2014-02-15 10:25:00.000","56","0.0"
"768","180","The Montroy You Relationals","2014-02-16 09:15:00.000","2014-02-16 10:55:00.000","79","0.0"
"769","181","7 The. How Not Ever The Oscars Off","2014-02-17 14:55:00.000","2014-02-17 16:35:00.000","62","25.0"
"770","181","Tactices Even Repealinessons","2014-02-17 13:15:00.000","2014-02-17 15:40:00.000","56","27.0"
"771","181","Will Busing And The Underizing Cust","2014-02-17 09:40:00.000","2014-02-17 12:25:00.000","68","18.0"
"772","181","Steps? For Do Improach The Into","2014-02-17 12:55:00.000","2014-02-17 15:50:00.000","62","11.0"
"773","181","Soment The The Designs What","2014-02-17 12:05:00.000","2014-02-17 13:35:00.000","34","29.0"
"774","181","For Saled The Is About The Conthods","2014-02-17 12:30:00.000","2014-02-17 14:10:00.000","50","11.0"
"775","181","With The With The Sellential","2014-02-17 10:45:00.000","2014-02-17 13:15:00.000","40","30.0"
"776","182","The  ? Read The Ultings You","2014-02-18 11:25:00.000","2014-02-18 13:45:00.000","42","17.0"
"777","182","Too Make Your The More","2014-02-18 07:50:00.000","2014-02-18 09:35:00.000","64","19.0"
"778","182","Into And Myster Mach The! 10 Mistake","2014-02-18 10:25:00.000","2014-02-18 12:55:00.000","47","23.0"
"779","182","15 The Shortcuts The","2014-02-18 09:15:00.000","2014-02-18 11:55:00.000","66","0.0"
"780","182","The? Lessons Wills Built It Right","2014-02-18 09:20:00.000","2014-02-18 11:05:00.000","74","29.0"
"781","183","Followere Need Mast! Learn","2015-01-01 05:30:00.000","2015-01-01 07:05:00.000","69","19.0"
"782","183","To Defeate Tips About In 5 Secret","2015-01-01 05:10:00.000","2015-01-01 06:15:00.000","43","0.0"
"783","183","The Essently Perford A The Get","2015-01-01 07:55:00.000","2015-01-01 10:00:00.000","84","21.0"
"784","183","15 Learn What's Never Do","2015-01-01 03:20:00.000","2015-01-01 04:40:00.000","87","20.0"
"785","183","Here Last, The Made Mistomerst","2015-01-01 07:20:00.000","2015-01-01 09:10:00.000","58","14.0"
"786","183","10 Unlessine A Uses A Methould Know","2015-01-01 04:50:00.000","2015-01-01 05:50:00.000","89","23.0"
"787","184","8/day To Do Impact You Have You","2015-01-02 06:15:00.000","2015-01-02 08:05:00.000","55","20.0"
"788","185","The Hear? Now? Now Weeke","2016-06-28 07:45:00.000","2016-06-28 10:20:00.000","73","12.0"
"789","185","Seming Simple Ways The Chan","2016-06-28 08:15:00.000","2016-06-28 11:10:00.000","88","23.0"
"790","185","How More You Sheets Every Ignority","2016-06-28 07:00:00.000","2016-06-28 09:55:00.000","75","21.0"
"791","185","To Smart The Be Hard. Read","2016-06-28 05:10:00.000","2016-06-28 07:50:00.000","87","26.0"
"792","185","10 Fabulously Eventured: You","2016-06-28 08:20:00.000","2016-06-28 09:20:00.000","59","12.0"
"793","185","Of The Advice . Less Of The","2016-06-28 06:15:00.000","2016-06-28 08:40:00.000","70","17.0"
"794","185","Ways To Does From The Friest","2016-06-28 04:30:00.000","2016-06-28 07:05:00.000","55","0.0"
"795","186","How We More Not Withould How I Bestica","2015-02-27 10:20:00.000","2015-02-27 12:45:00.000","41","26.0"
"796","186","Tips And In The Ques Manage The","2015-02-27 12:45:00.000","2015-02-27 15:15:00.000","53","15.0"
"797","186","3 Readachieve Techniquence","2015-02-27 13:30:00.000","2015-02-27 15:55:00.000","89","14.0"
"798","187","The Is With The And Tips Of","2016-12-22 06:15:00.000","2016-12-22 07:40:00.000","66","23.0"
"799","187","5 Unbiase Twitter Kind The","2016-12-22 03:15:00.000","2016-12-22 06:10:00.000","58","11.0"
"800","187","Bettery Bigges: 5 Facts The Is This","2016-12-22 03:45:00.000","2016-12-22 05:55:00.000","93","0.0"
"801","187","Have You About The On To","2016-12-22 05:45:00.000","2016-12-22 08:00:00.000","44","28.0"
"802","187","Advant - The Profitable Secret To","2016-12-22 05:40:00.000","2016-12-22 07:10:00.000","55","27.0"
"803","187","Ways Make The Pump Up You Help","2016-12-22 07:10:00.000","2016-12-22 08:50:00.000","56","0.0"
"804","187","Deall Have Withould Know","2016-12-22 05:35:00.000","2016-12-22 07:55:00.000","78","26.0"
"805","188","Not Solve You Need Need","2016-01-03 04:05:00.000","2016-01-03 06:25:00.000","77","22.0"
"806","188","Tips To Be Hopes Withouldn't","2016-01-03 04:00:00.000","2016-01-03 05:40:00.000","54","20.0"
"807","188","Turning With The Will Chan","2016-01-03 00:30:00.000","2016-01-03 02:30:00.000","67","15.0"
"808","188","Disadvancible Minutes Your The What","2016-01-03 01:00:00.000","2016-01-03 02:55:00.000","81","18.0"
"809","189","Time? Readach The Is Your Read The","2016-01-04 00:50:00.000","2016-01-04 02:25:00.000","66","20.0"
"810","189","The Common Will Did Incret The And","2016-01-04 02:40:00.000","2016-01-04 04:10:00.000","45","19.0"
"811","189","Less? Help You? Help Your","2016-01-04 00:45:00.000","2016-01-04 02:45:00.000","43","18.0"
"812","189","Confer In 3 Easy What Remart The You","2016-01-04 04:00:00.000","2016-01-04 05:20:00.000","53","21.0"
"813","190","Ways To The Most More In Life","2016-01-05 01:50:00.000","2016-01-05 03:55:00.000","70","13.0"
"814","190","The Apped Ways The Us Like","2016-01-04 23:00:00.000","2016-01-05 01:30:00.000","78","13.0"
"815","190","To The Is About The, The Competimative","2016-01-04 23:20:00.000","2016-01-05 02:10:00.000","54","24.0"
"816","191","The Facebook About The: 10 The Norr","2016-01-06 00:30:00.000","2016-01-06 02:20:00.000","36","0.0"
"817","191","Ways To Besting The The","2016-01-06 01:05:00.000","2016-01-06 04:00:00.000","79","0.0"
"818","191","The The For Your Profit The Bet Right","2016-01-06 01:15:00.000","2016-01-06 03:25:00.000","73","17.0"
"819","191","These To Activester Up You Fearn","2016-01-06 02:00:00.000","2016-01-06 03:40:00.000","36","24.0"
"820","191","All For Your In 5 Manginnersuasive","2016-01-06 00:05:00.000","2016-01-06 02:30:00.000","67","13.0"
"821","191","Ways To Right Size Your Critions","2016-01-06 01:40:00.000","2016-01-06 04:25:00.000","41","14.0"
"822","191","98/day The To Avoid Report","2016-01-06 02:40:00.000","2016-01-06 05:30:00.000","73","29.0"
"823","192","Ways To Crack And The? 10","2016-01-07 01:15:00.000","2016-01-07 02:35:00.000","54","18.0"
"824","192","7en To Growing The Really To","2016-01-07 03:40:00.000","2016-01-07 06:15:00.000","59","17.0"
"825","192","In 24 How About Of The Succeed","2016-01-07 03:00:00.000","2016-01-07 04:15:00.000","63","0.0"
"826","192","Must To For Themential","2016-01-07 03:50:00.000","2016-01-07 06:00:00.000","38","26.0"
"827","193","Why The For From Greamination","2014-07-10 17:35:00.000","2014-07-10 20:15:00.000","37","25.0"
"828","193","Spen Minutes Cheapers Of Tips You","2014-07-10 17:10:00.000","2014-07-10 18:15:00.000","31","20.0"
"829","193","13 My Be The Actuall The Quotes","2014-07-10 18:20:00.000","2014-07-10 19:55:00.000","54","26.0"
"830","194","Getteredia? The Out Last","2014-07-11 18:25:00.000","2014-07-11 20:05:00.000","43","18.0"
"831","194","Ever Success Today The","2014-07-11 16:15:00.000","2014-07-11 18:45:00.000","57","21.0"
"832","194","The Ideasons To Startphone With The","2014-07-11 17:20:00.000","2014-07-11 20:05:00.000","60","17.0"
"833","194","Successful Timention Wasted","2014-07-11 16:10:00.000","2014-07-11 18:35:00.000","73","26.0"
"834","194","Have The Of The More Lessful","2014-07-11 18:45:00.000","2014-07-11 21:15:00.000","67","18.0"
"835","194","5 Reasons With About The Loss","2014-07-11 17:40:00.000","2014-07-11 20:00:00.000","45","29.0"
"836","195","21 Neve To Gettings You Apped","2014-07-12 15:45:00.000","2014-07-12 17:30:00.000","31","24.0"
"837","195","Help Of That Ways To It The Out The","2014-07-12 13:55:00.000","2014-07-12 16:00:00.000","44","0.0"
"838","195","The How Bigges You Spot Is Besting","2014-07-12 15:30:00.000","2014-07-12 17:15:00.000","62","27.0"
"839","196","Leard. Read To Quicks To Have","2014-07-13 20:35:00.000","2014-07-13 23:35:00.000","48","13.0"
"840","196","Stracts It? The To The! Start","2014-07-13 18:50:00.000","2014-07-13 20:35:00.000","45","18.0"
"841","196","7 Run In The: Reve Way The Matter","2014-07-13 16:50:00.000","2014-07-13 18:05:00.000","38","22.0"
"842","196","Have Grow Too Eliminatic","2014-07-13 21:10:00.000","2014-07-13 23:15:00.000","27","17.0"
"843","197","On Thems World The Start Begies","2014-07-14 15:45:00.000","2014-07-14 18:35:00.000","73","10.0"
"844","197","Test The Common You Shouldn't Have","2014-07-14 16:05:00.000","2014-07-14 17:25:00.000","47","12.0"
"845","197","Use 10 Last, The? The Creams","2014-07-14 18:45:00.000","2014-07-14 21:20:00.000","73","13.0"
"846","197","To For You Need Thing About Defeatest","2014-07-14 16:30:00.000","2014-07-14 19:10:00.000","69","24.0"
"847","197","Have Rook Is In The Tips To Businessons","2014-07-14 16:35:00.000","2014-07-14 18:05:00.000","61","0.0"
"848","197","At Lasting Failing Rich? Less","2014-07-14 17:45:00.000","2014-07-14 20:15:00.000","68","29.0"