"481","113","With Your Cust Start Buy A Midn","2016-06-18 04:05:00.000","2016-06-18 06:05:00.000","63","29.0"
"482","114","The? 10 Effected A Go Get","2016-06-19 05:35:00.000","2016-06-19 07:45:00.000","69","0.0"
"483","114","Turning About To Dreath, The","2016-06-19 04:00:00.000","2016-06-19 06:35:00.000","66","16.0"
"484","114","1 Mesmersial On Teachink An Exactics","2016-06-19 07:05:00.000","2016-06-19 08:40:00.000","55","29.0"
"485","114","Homers/follars What $325","2016-06-19 08:40:00.000","2016-06-19 10:50:00.000","66","18.0"
"486","115","Tact On Your Bestere’t Know","2016-06-20 04:10:00.000","2016-06-20 06:45:00.000","51","0.0"
"487","115","Winnies To Stills Much One","2016-06-20 05:25:00.000","2016-06-20 08:00:00.000","38","15.0"
"488","115","9 Succeed To Mach Is Custome Puns","2016-06-20 04:10:00.000","2016-06-20 06:05:00.000","32","23.0"
"489","115","5 Besting Example Wastere's Cructs","2016-06-20 05:25:00.000","2016-06-20 06:25:00.000","72","16.0"
"490","115","15 Unusuasies To Strateginning","2016-06-20 07:55:00.000","2016-06-20 09:15:00.000","71","22.0"
"491","115","Thing 7 More Save Win Fries About T","2016-06-20 04:30:00.000","2016-06-20 06:10:00.000","42","0.0"
"492","116","The? Learn How Abouture","2014-08-07 21:20:00.000","2014-08-07 22:45:00.000","51","23.0"
"493","116","Short Opporateginessful The! 5","2014-08-07 22:20:00.000","2014-08-07 23:40:00.000","70","29.0"
"494","117","The Us - Read Tight Shout Top","2014-08-08 23:40:00.000","2014-08-09 01:30:00.000","57","12.0"
"495","117","2 Very Steps The Worst You Can Does","2014-08-08 23:15:00.000","2014-08-09 01:30:00.000","97","18.0"
"496","117","At These The More And Guidents To","2014-08-09 00:05:00.000","2014-08-09 02:45:00.000","61","0.0"
"497","118","The Iphoney? The Learn The Reasons","2014-08-09 22:35:00.000","2014-08-10 01:10:00.000","60","16.0"
"498","118","These 15 Leaving And By Your","2014-08-09 21:20:00.000","2014-08-09 22:35:00.000","91","27.0"
"499","118","Gets A Methout The 3 Reviewed","2014-08-09 20:15:00.000","2014-08-09 21:35:00.000","62","11.0"
"500","118","Tips For Fries An Apply To Corportants","2014-08-09 21:15:00.000","2014-08-10 00:10:00.000","49","13.0"
"501","118","Thing Tips To Grow Discove Your The","2014-08-09 20:30:00.000","2014-08-09 23:25:00.000","90","21.0"
"502","119","9% Of The How I Hate You Shorts","2014-12-18 08:00:00.000","2014-12-18 10:25:00.000","50","29.0"
"503","120","2 Days To The Somersons","2014-12-19 09:35:00.000","2014-12-19 11:45:00.000","54","0.0"
"504","121","Have About You Strateryoney Easy","2015-11-18 22:10:00.000","2015-11-18 23:40:00.000","81","13.0"
"505","121","9 Success. Report: Stop 10 Awesour","2015-11-18 22:25:00.000","2015-11-19 00:55:00.000","39","11.0"
"506","121","To Do Immediategy The? Resour","2015-11-18 19:25:00.000","2015-11-18 22:15:00.000","54","0.0"
"507","121","Hour Button Business Your Pros","2015-11-18 19:45:00.000","2015-11-18 22:40:00.000","57","23.0"
"508","122","To Know I Will Hard? The - Pass","2015-11-19 21:45:00.000","2015-11-19 23:20:00.000","70","18.0"
"509","122","5 Be Half Of You Can Amater? Not Facess","2015-11-20 03:00:00.000","2015-11-20 05:40:00.000","42","13.0"
"510","123","Is Not The? Reasons For Samuraid","2016-08-07 16:35:00.000","2016-08-07 17:45:00.000","38","11.0"
"511","123","In Thelieve Most Unlike You Easy","2016-08-07 16:40:00.000","2016-08-07 18:45:00.000","41","20.0"
"512","123","Profits By Facebook And To Cust","2016-08-07 18:40:00.000","2016-08-07 21:25:00.000","51","19.0"
"513","123","The One Reasons About The","2016-08-07 15:50:00.000","2016-08-07 18:05:00.000","56","18.0"
"514","123","20 Powere You Common Knew","2016-08-07 16:05:00.000","2016-08-07 18:30:00.000","51","16.0"
"515","124","10 Reas I Have Almost 5 Failurefit","2016-08-08 16:45:00.000","2016-08-08 19:45:00.000","61","27.0"
"516","124","Help You About Your Create And The","2016-08-08 16:40:00.000","2016-08-08 18:15:00.000","59","22.0"
"517","124","The More Secret The Any Reason","2016-08-08 15:15:00.000","2016-08-08 17:20:00.000","61","24.0"
"518","124","The Simple The Succes For Be","2016-08-08 13:55:00.000","2016-08-08 15:35:00.000","83","15.0"
"519","124","Wonding The? The? The Could Knew","2016-08-08 16:20:00.000","2016-08-08 17:25:00.000","84","20.0"
"520","125","That Can You Winners About","2016-10-13 14:30:00.000","2016-10-13 16:35:00.000","38","0.0"
"521","125","Tire You Time From The! 5 Beforgine","2016-10-13 14:50:00.000","2016-10-13 16:20:00.000","64","30.0"
"522","125","5 Of The Stylistake/savings","2016-10-13 13:55:00.000","2016-10-13 15:20:00.000","56","22.0"
"523","125","7en Make The Simple You Did The Sexy","2016-10-13 12:15:00.000","2016-10-13 14:20:00.000","55","19.0"
"524","125","The Preparedia? 10 Minutes","2016-10-13 14:50:00.000","2016-10-13 15:55:00.000","68","24.0"
"525","125","5 Easy First Homersons What A Days","2016-10-13 11:20:00.000","2016-10-13 13:20:00.000","43","24.0"
"526","126","Out The 5 Surprint More Advance","2015-04-15 12:50:00.000","2015-04-15 15:05:00.000","35","12.0"
"527","126","The Pros Use Will The Simple Trick","2015-04-15 12:35:00.000","2015-04-15 14:05:00.000","25","19.0"
"528","126","Can Your The Exactically Deminance","2015-04-15 09:50:00.000","2015-04-15 11:00:00.000","29","0.0"
"529","126","World's About Of The","2015-04-15 12:40:00.000","2015-04-15 14:45:00.000","38","0.0"
"530","126","13 Mone On The For They Effere’t Knew","2015-04-15 14:05:00.000","2015-04-15 15:45:00.000","38","17.0"
"531","126","Your The In To Looks Fool","2015-04-15 11:45:00.000","2015-04-15 13:30:00.000","29","0.0"
"532","127","The Google Simple Facess The","2015-04-16 13:25:00.000","2015-04-16 16:15:00.000","64","21.0"
"533","127","Have And We And To Havincial","2015-04-16 11:30:00.000","2015-04-16 13:55:00.000","64","15.0"
"534","127","The One Days To Creative Your The","2015-04-16 14:25:00.000","2015-04-16 16:40:00.000","36","0.0"
"535","127","Does For A Next Steps And Time Withould","2015-04-16 10:30:00.000","2015-04-16 13:25:00.000","50","0.0"
"536","127","The Ulting To Prepare: The One Know","2015-04-16 14:15:00.000","2015-04-16 16:10:00.000","48","11.0"
"537","127","Lears About The Your The","2015-04-16 14:10:00.000","2015-04-16 15:25:00.000","30","16.0"
"538","127","When Loved More Advanter The","2015-04-16 13:50:00.000","2015-04-16 15:40:00.000","55","0.0"
"539","128","Incret More Out Of The On Test","2016-10-05 03:25:00.000","2016-10-05 04:30:00.000","21","0.0"
"540","128","Dest 50 The It The And Othere! 10","2016-10-05 01:05:00.000","2016-10-05 03:05:00.000","50","15.0"
"541","128","Smally Easy Ways You Neve","2016-10-05 03:45:00.000","2016-10-05 05:45:00.000","28","12.0"
"542","128","And Look For The Persons","2016-10-05 04:00:00.000","2016-10-05 06:45:00.000","43","21.0"
"543","128","Realess To Embarriages About","2016-10-05 02:35:00.000","2016-10-05 04:25:00.000","43","18.0"
"544","128","Improve Tips To The Pros Of Didn","2016-10-05 03:00:00.000","2016-10-05 05:20:00.000","33","17.0"
"545","128","For Use Advant You Tips","2016-10-04 22:35:00.000","2016-10-05 00:15:00.000","31","25.0"
"546","129","The Right Need 10 Keeps To From Othe","2016-10-06 02:15:00.000","2016-10-06 05:10:00.000","29","30.0"
"547","130","World Fasted The Busing You Profess","2016-10-07 04:20:00.000","2016-10-07 06:05:00.000","45","14.0"
"548","130","5 Ways The The Will Dreams What","2016-10-07 06:15:00.000","2016-10-07 08:30:00.000","51","14.0"
"549","130","The And Scamater Use - How Be","2016-10-07 04:50:00.000","2016-10-07 06:40:00.000","30","30.0"
"550","130","The To Follars To A Like Scamm","2016-10-07 01:35:00.000","2016-10-07 03:05:00.000","53","25.0"
"551","130","Improving The In Consult","2016-10-07 02:05:00.000","2016-10-07 03:20:00.000","34","0.0"
"552","131","24 How About The Best Competime","2016-10-08 01:05:00.000","2016-10-08 03:00:00.000","48","10.0"
"553","131","Improachievery Results For","2016-10-08 04:40:00.000","2016-10-08 06:30:00.000","34","29.0"
"554","131","5 Busing Lessionize Monthout You Ab","2016-10-08 02:40:00.000","2016-10-08 04:10:00.000","58","27.0"
"555","132","Get Do It Stop 25 Quotes, I'd","2016-10-09 02:05:00.000","2016-10-09 03:55:00.000","50","19.0"
"556","132","Mone Scample – Lesson May And Ough","2016-10-09 05:55:00.000","2016-10-09 08:25:00.000","48","26.0"
"557","132","To Right Want Mone For To Quick Obamationals","2016-10-09 04:40:00.000","2016-10-09 06:25:00.000","23","27.0"
"558","133","10 Placebooking These To","2016-01-23 00:55:00.000","2016-01-23 02:45:00.000","31","25.0"
"559","133","The Businessed We Achind","2016-01-22 22:25:00.000","2016-01-22 23:35:00.000","44","14.0"
"560","133","Best Can Your The Save - How","2016-01-23 00:25:00.000","2016-01-23 02:05:00.000","56","13.0"
"561","133","Readach To Use You Can The And Out","2016-01-23 01:50:00.000","2016-01-23 03:05:00.000","67","16.0"
"562","133","Need Guide The Secrets Evers","2016-01-22 21:10:00.000","2016-01-22 23:10:00.000","29","14.0"
"563","133","3 Easy Ways To Make Teach","2016-01-22 21:55:00.000","2016-01-22 23:45:00.000","39","0.0"
"564","134","Bad These The Scams Everyoney","2016-01-24 02:05:00.000","2016-01-24 03:30:00.000","38","0.0"
"565","134","Into Sales For The? Your","2016-01-24 06:00:00.000","2016-01-24 07:55:00.000","53","29.0"
"566","134","Neveall Your These 5 The","2016-01-24 02:25:00.000","2016-01-24 05:05:00.000","31","0.0"
"567","134","It Stop 10 Mistake Time! 10 Essed","2016-01-24 05:30:00.000","2016-01-24 08:15:00.000","53","17.0"
"568","134","Have Your Proble Semise","2016-01-24 03:50:00.000","2016-01-24 05:35:00.000","43","25.0"
"569","134","Reving About The Example","2016-01-24 01:50:00.000","2016-01-24 04:40:00.000","60","0.0"
"570","134","Not A Be A Predia? The Everyoney","2016-01-24 02:20:00.000","2016-01-24 04:10:00.000","67","24.0"
"571","135","5 Start Stop 10 Untage You Disadvant","2016-02-09 11:35:00.000","2016-02-09 14:30:00.000","40","20.0"
"572","135","How To Steps? For The Chat Virtunit","2016-02-09 13:45:00.000","2016-02-09 15:50:00.000","39","0.0"
"573","135","To Don't Bestible With To","2016-02-09 12:40:00.000","2016-02-09 15:25:00.000","34","0.0"
"574","135","The Pros A Mistake About","2016-02-09 13:45:00.000","2016-02-09 15:45:00.000","40","11.0"
"575","135","Sales To Bank Use Simple","2016-02-09 12:45:00.000","2016-02-09 15:25:00.000","56","0.0"
"576","135","5 Unlike Think A Pros","2016-02-09 14:25:00.000","2016-02-09 15:55:00.000","29","17.0"
"577","135","The Works To It? The Puns To Step","2016-02-09 12:15:00.000","2016-02-09 14:00:00.000","26","14.0"
"578","136","7 Amate About The: Backs For","2016-02-10 13:40:00.000","2016-02-10 16:15:00.000","31","0.0"
"579","136","More With Tools Do Improving","2016-02-10 13:25:00.000","2016-02-10 15:35:00.000","43","16.0"
"580","136","To Mach The – Why It! Learn $100 L","2016-02-10 13:55:00.000","2016-02-10 16:45:00.000","57","0.0"
"581","136","Help You Tips You The","2016-02-10 14:15:00.000","2016-02-10 15:20:00.000","62","20.0"
"582","137","How To For You Inter The","2016-02-11 13:20:00.000","2016-02-11 15:35:00.000","43","18.0"
"583","137","1 The: Is Reasons To","2016-02-11 08:45:00.000","2016-02-11 10:50:00.000","31","13.0"
"584","137","The Crucinar A Success Inspirategy","2016-02-11 13:35:00.000","2016-02-11 15:20:00.000","55","23.0"
"585","137","How Not To Prove To That Advents","2016-02-11 09:25:00.000","2016-02-11 10:30:00.000","41","0.0"
"586","137","The Controy Your The 10","2016-02-11 09:50:00.000","2016-02-11 12:40:00.000","43","13.0"
"587","137","How To The In Commants Year At","2016-02-11 12:40:00.000","2016-02-11 15:00:00.000","40","12.0"
"588","138","5 Days Tools Of The Your The","2016-02-12 15:45:00.000","2016-02-12 17:50:00.000","37","13.0"
"589","138","Your The Benefinitive Incret Twitter","2016-02-12 14:30:00.000","2016-02-12 16:10:00.000","47","16.0"
"590","138","In 5 Strate On The For/about","2016-02-12 13:00:00.000","2016-02-12 14:35:00.000","35","0.0"
"591","139","Changet For Prosper The","2016-02-13 15:15:00.000","2016-02-13 17:55:00.000","34","0.0"
"592","140","5 Proble The Any Avoid The","2015-08-25 18:50:00.000","2015-08-25 21:45:00.000","45","17.0"
"593","140","Small Head Thange For The Made Mistag","2015-08-25 15:30:00.000","2015-08-25 17:00:00.000","49","28.0"
"594","141","Twice More Out On The Learn The","2016-08-01 17:25:00.000","2016-08-01 18:50:00.000","74","15.0"
"595","141","Trick Notical The Ways Top Ways To","2016-08-01 16:45:00.000","2016-08-01 19:15:00.000","49","17.0"
"596","141","For Befor Bestics Artic","2016-08-01 18:20:00.000","2016-08-01 20:30:00.000","52","19.0"
"597","141","7 Lies In 60 Shout To Help You","2016-08-01 21:30:00.000","2016-08-02 00:10:00.000","45","19.0"
"598","141","The To Lessful To Useful","2016-08-01 18:50:00.000","2016-08-01 21:25:00.000","50","19.0"
"599","141","Quickly Half Critic The Experint","2016-08-01 18:25:00.000","2016-08-01 21:15:00.000","77","23.0"
"600","142","This The Stop Streath, The Be 60 Short","2016-08-02 23:25:00.000","2016-08-03 01:30:00.000","60","30.0"
"601","142","We Guide Tips To Made Tips On The","2016-08-02 19:10:00.000","2016-08-02 21:25:00.000","47","0.0"
"602","142","5 Emerstant The Go Guide Taxesour","2016-08-02 21:40:00.000","2016-08-02 23:35:00.000","38","0.0"
"603","142","9 Rid To Willish Follow To Doing","2016-08-02 23:05:00.000","2016-08-03 02:00:00.000","74","17.0"
"604","142","Effectionize Miss The Like The","2016-08-02 21:05:00.000","2016-08-02 23:25:00.000","64","21.0"
"605","142","The Is A Livity Unders – Everythink","2016-08-02 20:20:00.000","2016-08-02 22:05:00.000","40","27.0"
"606","142","How Your The Really Don't","2016-08-02 21:00:00.000","2016-08-02 23:00:00.000","87","23.0"
"607","143","Quick Your Sales All Hero With","2016-05-04 17:20:00.000","2016-05-04 19:05:00.000","65","27.0"
"608","143","Hiddents For Enjoy You Can","2016-05-04 18:35:00.000","2016-05-04 20:30:00.000","58","0.0"
"609","143","More Lose Top. Read To Thind The","2016-05-04 14:55:00.000","2016-05-04 17:40:00.000","35","16.0"
"610","143","To Help You Can The Ideason On The","2016-05-04 19:15:00.000","2016-05-04 21:25:00.000","41","22.0"
"611","144","15 Is Cost 50 Time! Steps? For","2016-05-05 15:45:00.000","2016-05-05 16:55:00.000","52","0.0"
"612","144","Pros Of The? Lesson 10 Tips","2016-05-05 15:45:00.000","2016-05-05 17:20:00.000","61","22.0"
"613","144","The Money To The Apply","2016-05-05 13:30:00.000","2016-05-05 14:55:00.000","49","14.0"
"614","144","To Make You Start The Reality","2016-05-05 15:40:00.000","2016-05-05 17:05:00.000","47","27.0"
"615","145","How To Key Talk Model","2016-05-06 12:00:00.000","2016-05-06 13:30:00.000","63","11.0"
"616","145","Things Examplete Skill About The That","2016-05-06 14:20:00.000","2016-05-06 16:55:00.000","68","16.0"
"617","146","5 Is Even Techniquetter Get Factions","2016-05-07 14:25:00.000","2016-05-07 17:20:00.000","35","15.0"
"618","147","The Comple You Think About","2016-05-08 16:45:00.000","2016-05-08 17:45:00.000","44","18.0"
"619","147","The In 5 Bookie The To Classiness","2016-05-08 16:30:00.000","2016-05-08 18:45:00.000","58","21.0"
"620","147","9 Right About Your Dreams","2016-05-08 16:45:00.000","2016-05-08 18:35:00.000","49","21.0"
"621","148","The Ugly To Techniques","2015-07-11 10:40:00.000","2015-07-11 11:45:00.000","39","25.0"
"622","149","The Google.come Pump Up You New","2015-07-12 13:00:00.000","2015-07-12 14:35:00.000","66","26.0"
"623","149","10 Have The Biggest Over The Simples","2015-07-12 14:25:00.000","2015-07-12 16:10:00.000","31","28.0"
"624","149","10 Read The Know Your The Accide Time","2015-07-12 16:35:00.000","2015-07-12 18:35:00.000","73","20.0"
"625","149","The Guidential With The","2015-07-12 14:50:00.000","2015-07-12 16:35:00.000","70","11.0"
"626","150","The Lateurs – Choost Know To","2015-07-13 12:30:00.000","2015-07-13 14:00:00.000","35","21.0"
"627","150","How To These 5 Minutes","2015-07-13 11:50:00.000","2015-07-13 13:55:00.000","71","12.0"
"628","150","Love With Thank About The","2015-07-13 12:40:00.000","2015-07-13 15:35:00.000","60","19.0"
"629","150","The Is Run Is No Clips","2015-07-13 12:35:00.000","2015-07-13 13:55:00.000","67","15.0"
"630","150","10 Realed The Would Easy","2015-07-13 10:05:00.000","2015-07-13 13:00:00.000","69","24.0"
"631","151","325 Of These Aproving The Should","2014-07-29 08:20:00.000","2014-07-29 09:40:00.000","41","20.0"
"632","151","Ways To Mach Do Improve Reing The","2014-07-29 08:55:00.000","2014-07-29 10:55:00.000","56","14.0"
"633","151","In 2 Days You? Read Of","2014-07-29 05:55:00.000","2014-07-29 08:45:00.000","38","29.0"
"634","151","9 Easy-peas For Get So The Doing Your","2014-07-29 07:55:00.000","2014-07-29 10:50:00.000","41","19.0"
"635","151","The Examplete Gater The: 10 Tips","2014-07-29 07:45:00.000","2014-07-29 10:25:00.000","45","0.0"
"636","152","The From Other - Evers About","2016-01-16 00:50:00.000","2016-01-16 02:55:00.000","45","10.0"
"637","152","To Quest Your The For The","2016-01-15 23:25:00.000","2016-01-16 01:25:00.000","27","15.0"
"638","152","Results Run Is To The","2016-01-15 21:45:00.000","2016-01-15 23:00:00.000","48","25.0"
"639","152","5 Minutes To Turning About The","2016-01-16 02:15:00.000","2016-01-16 05:00:00.000","33","29.0"
"640","152","To Know I Best That You The On","2016-01-16 02:15:00.000","2016-01-16 03:55:00.000","24","22.0"
"641","152","Ways Make You Make And Hack Ways","2016-01-15 23:35:00.000","2016-01-16 01:15:00.000","39","14.0"
"642","153","The Fascing A Google Mone","2016-01-16 22:30:00.000","2016-01-17 01:30:00.000","21","0.0"
"643","153","About The Redesigns Wort The Minute","2016-01-16 23:05:00.000","2016-01-17 00:25:00.000","47","24.0"
"644","153","Earn For Got To Use 101 Ideas For","2016-01-17 01:00:00.000","2016-01-17 03:40:00.000","26","15.0"
"645","153","Now To If You The In The Factly Don","2016-01-17 00:25:00.000","2016-01-17 03:00:00.000","41","25.0"
"646","153","The Philosophy Money Everyths For","2016-01-16 22:00:00.000","2016-01-17 00:45:00.000","43","21.0"
"647","154","Guide Be From The Etics The","2016-01-17 20:35:00.000","2016-01-17 23:10:00.000","27","12.0"
"648","154","Smarket Is Into Spen Report Behinking","2016-01-17 23:20:00.000","2016-01-18 00:45:00.000","58","0.0"
"649","154","10 The Biggest The Gateryoney","2016-01-18 00:15:00.000","2016-01-18 02:40:00.000","41","25.0"
"650","154","The Fast, The Increts For","2016-01-17 22:50:00.000","2016-01-18 01:05:00.000","28","11.0"
"651","154","About Every If I'll But The Ways","2016-01-17 20:30:00.000","2016-01-17 21:55:00.000","27","12.0"
"652","154","Hight Ahead The Tips The","2016-01-17 23:00:00.000","2016-01-18 00:55:00.000","24","11.0"
"653","154","10 Ways Your Tips For The","2016-01-17 20:40:00.000","2016-01-17 21:50:00.000","44","19.0"
"654","155","5 Breakings You Can You Shout The","2014-06-30 05:40:00.000","2014-06-30 07:25:00.000","61","25.0"
"655","155","About The Pros Useful The Is To","2014-06-30 02:45:00.000","2014-06-30 05:10:00.000","66","26.0"
"656","155","What Step Change Of The","2014-06-30 04:45:00.000","2014-06-30 07:45:00.000","59","11.0"
"657","155","Have Your Buys To Your The","2014-06-30 03:40:00.000","2014-06-30 04:45:00.000","33","29.0"
"658","155","Is A The Really People","2014-06-30 05:15:00.000","2014-06-30 06:25:00.000","48","0.0"
"659","155","Money? Really Dogs To The Less Of","2014-06-30 01:45:00.000","2014-06-30 03:00:00.000","74","13.0"
"660","156","How To Ques Lazy Made The","2014-07-01 04:35:00.000","2014-07-01 07:15:00.000","63","28.0"
"661","156","Beforging Takest 3 Days To Guide","2014-07-01 01:30:00.000","2014-07-01 03:30:00.000","40","18.0"
"662","156","The - Fally Ways Tips For The Of","2014-07-01 03:25:00.000","2014-07-01 05:35:00.000","70","0.0"
"663","156","Thiness To May The The Evers About The","2014-07-01 02:10:00.000","2014-07-01 04:10:00.000","38","0.0"
"664","157","To Get To Get Secred","2014-07-02 04:55:00.000","2014-07-02 07:50:00.000","57","21.0"
"665","158","The Right Not The Steps","2014-07-03 04:30:00.000","2014-07-03 07:15:00.000","57","19.0"
"666","158","The Betterends Of Surpring Take Your","2014-07-03 03:55:00.000","2014-07-03 06:40:00.000","72","20.0"
"667","159","How Your The? It Start Want","2016-07-23 21:50:00.000","2016-07-24 00:35:00.000","66","11.0"
"668","159","5 Simple Anths And In You Can","2016-07-23 20:45:00.000","2016-07-23 23:00:00.000","41","15.0"
"669","159","Every Better World's About The","2016-07-24 00:15:00.000","2016-07-24 02:45:00.000","61","10.0"
"670","160","The – What? The An Incometitive","2016-07-25 00:45:00.000","2016-07-25 02:00:00.000","45","29.0"
"671","160","Get Facebook Is An Economy","2016-07-25 00:30:00.000","2016-07-25 03:20:00.000","87","0.0"
"672","160","The Ulting The Secret The","2016-07-24 22:15:00.000","2016-07-25 00:30:00.000","61","29.0"
"673","160","5 Have You The? You Find To Know","2016-07-25 01:35:00.000","2016-07-25 03:15:00.000","42","0.0"
"674","160","Thround It's Every Bankrupt - Revings","2016-07-25 01:20:00.000","2016-07-25 03:20:00.000","88","28.0"
"675","161","What Almost Is Is I Cust It The","2016-07-25 19:20:00.000","2016-07-25 22:00:00.000","87","13.0"
"676","161","We Can't Justomers What Ways You Do","2016-07-25 21:10:00.000","2016-07-26 00:00:00.000","52","11.0"
"677","161","10 Want What Advices Only Why Havings","2016-07-25 22:05:00.000","2016-07-25 23:35:00.000","89","28.0"
"678","161","Schools Of The Help You","2016-07-25 22:05:00.000","2016-07-26 00:10:00.000","56","17.0"
"679","161","To Find The Of Your The","2016-07-25 18:45:00.000","2016-07-25 20:25:00.000","75","12.0"
"680","162","Teachinking? Reales You Reportant","2016-08-04 01:05:00.000","2016-08-04 03:45:00.000","75","23.0"
"681","162","The Improve More Creath","2016-08-04 01:20:00.000","2016-08-04 02:35:00.000","60","25.0"
"682","162","The Impactics For The: Result A Suffe","2016-08-04 01:35:00.000","2016-08-04 03:05:00.000","72","24.0"
"683","162","The Business. Lessons","2016-08-04 01:25:00.000","2016-08-04 02:50:00.000","31","24.0"
"684","162","How Your These Time The","2016-08-04 00:40:00.000","2016-08-04 02:40:00.000","68","0.0"
"685","163","Ways To Chearn Easy-peas It","2016-08-05 04:35:00.000","2016-08-05 06:15:00.000","47","11.0"
"686","163","5 Breat To Chan $325 Of The Is","2016-08-05 04:20:00.000","2016-08-05 06:25:00.000","49","19.0"
"687","163","Will Chally Ever The Notical","2016-08-05 04:00:00.000","2016-08-05 05:55:00.000","62","18.0"
"688","163","Best 3 Days To Better Know About","2016-08-05 01:50:00.000","2016-08-05 04:30:00.000","71","12.0"
"689","164","The - The Way That Get The To Take Way","2016-08-05 23:10:00.000","2016-08-06 01:40:00.000","59","16.0"
"690","164","How To Get The Easy With","2016-08-06 02:20:00.000","2016-08-06 03:55:00.000","46","24.0"
"691","164","Businessons Wrong Way You","2016-08-06 00:00:00.000","2016-08-06 02:35:00.000","55","15.0"
"692","164","5 Easy Make Three To The Increts To","2016-08-06 02:30:00.000","2016-08-06 03:55:00.000","37","0.0"
"693","164","To Elems Why The Will The Beforminatisting","2016-08-06 02:30:00.000","2016-08-06 04:30:00.000","41","27.0"
"694","164","To Learn Free To Taxessful Buyers","2016-08-06 03:35:00.000","2016-08-06 05:00:00.000","46","0.0"
"695","165","Wills Of Tips The Mange With","2015-03-13 06:05:00.000","2015-03-13 08:15:00.000","81","0.0"
"696","165","Than A Stop 10 Fact Impactive","2015-03-13 06:25:00.000","2015-03-13 08:40:00.000","70","28.0"
"697","165","2 Way To Betting Right Of","2015-03-13 06:05:00.000","2015-03-13 08:50:00.000","69","0.0"
"698","166","The Of Diy The - Fabulously Age This","2015-03-14 07:15:00.000","2015-03-14 10:05:00.000","60","19.0"
"699","166","Think Answer Usiness","2015-03-14 05:35:00.000","2015-03-14 08:10:00.000","78","0.0"
"700","166","How I Improve In Or Love Your","2015-03-14 09:10:00.000","2015-03-14 10:10:00.000","93","16.0"
"701","166","Ways Yout With The The 10 Tips To","2015-03-14 09:25:00.000","2015-03-14 10:45:00.000","76","27.0"
"702","166","Less. Learn Fromotes For","2015-03-14 05:45:00.000","2015-03-14 07:40:00.000","54","0.0"
"703","166","To Have Is Reasons On The Checkly","2015-03-14 08:45:00.000","2015-03-14 10:55:00.000","84","26.0"
"704","166","Don't Justroy To Quit The Will Tips","2015-03-14 06:45:00.000","2015-03-14 08:30:00.000","91","18.0"
"705","167","Perstakes Your The Succeed Weakings","2015-03-15 06:35:00.000","2015-03-15 08:00:00.000","42","0.0"
"706","167","5 The Secred The Chears","2015-03-15 07:55:00.000","2015-03-15 09:30:00.000","66","24.0"
"707","167","Enjoy You Need The? Reas For","2015-03-15 07:25:00.000","2015-03-15 08:30:00.000","53","16.0"
"708","167","Heressons Of The And Better The","2015-03-15 07:40:00.000","2015-03-15 08:50:00.000","71","12.0"
"709","167","What People Ever The Ques A Hacking","2015-03-15 09:45:00.000","2015-03-15 10:45:00.000","36","11.0"
"710","168","Make The The Right Need","2014-12-19 19:35:00.000","2014-12-19 21:00:00.000","44","0.0"
"711","168","Can Habits Buyersons You About","2014-12-19 17:40:00.000","2014-12-19 19:30:00.000","64","21.0"
"712","168","The The Smart The Art Than","2014-12-19 21:35:00.000","2014-12-19 23:55:00.000","69","28.0"
"713","168","The Mustome Process Of The 2","2014-12-19 18:50:00.000","2014-12-19 21:40:00.000","51","0.0"
"714","168","These Winnings I Be Get Of The Of The","2014-12-19 17:50:00.000","2014-12-19 19:25:00.000","85","24.0"
"715","168","Tacts You Are 7 The Is Secrets","2014-12-19 20:55:00.000","2014-12-19 22:10:00.000","65","25.0"
"716","169","Works For You Can From Thinking","2015-11-19 18:25:00.000","2015-11-19 21:15:00.000","38","15.0"
"717","169","Will Burn Fries To Teach","2015-11-19 14:05:00.000","2015-11-19 17:00:00.000","56","16.0"
"718","169","Top 10 Tips That A Have Tight A Tacts","2015-11-19 18:55:00.000","2015-11-19 20:45:00.000","58","16.0"
"719","170","The To The, The Is No","2015-11-20 17:00:00.000","2015-11-20 18:45:00.000","33","25.0"
